{
  "schema_version": "logicpearl.artifact_manifest.v1",
  "artifact_id": "revenue_route_payment_variance",
  "artifact_kind": "gate",
  "engine_version": "0.1.5",
  "ir_version": "1.0",
  "created_at": "2026-04-12T00:00:00Z",
  "artifact_hash": "sha256:a5713e9317f7c6ba74dd2ca068f6e14eb342b5ebad2b533615e999829ecab203",
  "files": {
    "ir": "pearl.ir.json",
    "build_report": "build_report.json"
  },
  "input_schema_hash": "sha256:db09e659c717310a990414b7460e7f1398c1dcec5391ef58414836b80d26cb98",
  "file_hashes": {
    "ir": "sha256:a5713e9317f7c6ba74dd2ca068f6e14eb342b5ebad2b533615e999829ecab203",
    "build_report": "sha256:26096524f8d041ec82a5729ca0822909550d00be670bab80dd4495afab739858"
  },
  "bundle_hash": "sha256:8f759187bb609b72a7841c031002c4f9d31fbb1d8ea6242d66cdcd0a61c585f8"
}
