{
  "schema_version": "logicpearl.artifact_manifest.v1",
  "artifact_id": "bcbsma_conservative_therapy_prereq_003_transcutaneous_electrical_nerve_stimulation_prn",
  "artifact_kind": "gate",
  "engine_version": "0.1.5",
  "ir_version": "1.0",
  "created_at": "2026-04-12T00:00:00Z",
  "artifact_hash": "sha256:bd96a39dd692e3c474463678e5a59fb45fabd95fa3fd49c1c141ec57b9cb6f96",
  "files": {
    "ir": "pearl.ir.json",
    "build_report": "build_report.json"
  },
  "input_schema_hash": "sha256:6f0b4ca1b88787fb60125c2925a7a05aac03b3266799606fbd1e37453f850d57",
  "file_hashes": {
    "ir": "sha256:bd96a39dd692e3c474463678e5a59fb45fabd95fa3fd49c1c141ec57b9cb6f96",
    "build_report": "sha256:83f3651a506e45c0baee9472a7df096cf40f7b662242879017f3eca6a040a1b3"
  },
  "bundle_hash": "sha256:c84657cb57b5e1a6c312ef7bfcea012bce3024568952ebcec0ff042060232b47"
}
