{
  "schema_version": "logicpearl.artifact_manifest.v1",
  "artifact_id": "bcbsma_documentation_requirement_049_drug_management_retail_pharmacy_prior_authorization_policy",
  "artifact_kind": "gate",
  "engine_version": "0.1.5",
  "ir_version": "1.0",
  "created_at": "2026-04-12T00:00:00Z",
  "artifact_hash": "sha256:b70e790a9a5207ba6837015e13367d17d6f9339389781c4eebe7d08cac9d7a6b",
  "files": {
    "ir": "pearl.ir.json",
    "build_report": "build_report.json"
  },
  "input_schema_hash": "sha256:29c55cf51d265590f8a5b048abeaba4bc9f211073d1d0c2faf7cc7f60b95b970",
  "file_hashes": {
    "ir": "sha256:b70e790a9a5207ba6837015e13367d17d6f9339389781c4eebe7d08cac9d7a6b",
    "build_report": "sha256:e9a649f35ec0aa05ce2c38d23f2570a745aa81b0cb3e05f5c501a2b245bd5833"
  },
  "bundle_hash": "sha256:442973fd61b85be56334ddad61a79e2d4e65941b139cfafb0b490a3f9b4d8240"
}
